Messege,Manual Sentiment
Hey VirginAtlantic take travel cot free part baggage allowance Thanks,Positive
JetBlue Cant log iPhone app know issue,Neutral
You take pushchair car seat part infants baggage allowance travel cot,Neutral
I know better tweet back solutions text send email number,Positive
say com U may text message gateway activate,Neutral
Hi My first name last name wrong way around ticket ref FCIQN spell correct problem,Negative
Hi worry name sequence long spell correct,Neutral
Which discontinue Aldi products want make comeback Tweet nut Aldi bring back,Neutral
Im renew annual season ticket Who shall I write cheque,Neutral
Cheques must make payable First Great Western Ltd Company cheque accept payment annual season ticket,Positive
Can assist skiza tune unsubscription detail SafaricomCare,Neutral
Hi delete skiza kindly send SMS format Delete ltskiza codegt cost kshs know song cod Cont,Positive
When I get home Im take ass bed fuck sleep Bank America get LAST nerve today,Negative
Hi problem solve Really Tired Bank America,Negative
Call Support additional help,Positive
I order hypnosis crystals eBay couple weeks agothey get bag regular rocksthe UPS man lock,Neutral
anything help Feel free email detail email follow LK,Positive
UPSHelp man lock basement If expect get deliver high quality hypnosis crystals Snake Mountain,Neutral
Virtual Visa Gift Card website sure look simple use make realize convolute piece junk Embarrassing,Negative
Sorry issue website Did need help Thanks JG,Positive
AskCiti Error message invalid rout number actually mean transfer fail system cant handle gt transfer account,Negative
Try disconnectingreconnecting coax connections router power cycle Then run test hardwired device SEM,Neutral
Himanshu Kapania MD Idea Cellular share view company growth talk business prospect,Positive
McDonalds grill chicken mcwrap calories dollar pound bargain,Neutral
Thanks,Positive
Sorry party rockin,Neutral
CenturyLink currently experience service disruption We work restore service apologize inconvenience,Negative
TMobileHelp Google Wallet,Neutral
We choose work ISIS hope roll everyone soon currently test KM,Positive
accord either keep google wallet work note Any timeframe,Neutral
Were support ISIS wireless payment standard mobile devices VS,Positive
TMobileHelp suck available locations No matter I always root install app choose Thx reply,Negative
Hopefully success ISIS expand additional areas JR,Positive
Go confidently direction dream live life Imagined Thoreau Good Morning,Positive
ChaseSupport Where I faxemail POA grandmothers Chase Credit card,Neutral
You fax document Chase Card Services SW,Neutral
Crosssection crowd PortHarcourt GloSlideNBounceTour,Neutral
Your password strength algoritm buggy If R weak passwords strong ones,Positive
Have try another browser,Neutral
Off University soon We use UniTip help process Share tip may RT faves,Positive
AldiUK new Zealand lamb halal chicken halal beef halal,Neutral
We label products Halal certify continually review products possibility introduce Halal certify meat,Neutral
AldiUK I correct assume halal label,Neutral
All Aldi meat prestunned meat products source abattoirs employ Halal slaughter techniques,Neutral
alongside nonHalal slaughter techniques,Neutral
AldiUK I purchase unless clearly label animalcruelty,Positive
Personally I think AmericanAir need dance floor disco ball cocktail bar vintage cocktail waitress,Neutral
That sound like fun Sunita We wear disco fashion,Positive
We might need take look account Please send usernameemail DM,Positive
SpotifyCares say available offline mode never do,Negative
Hey Scotty platformdevice use app Give reinstall go,Positive
tmobilehelp Blocking Google Wallet ISIS unfair comptetition net neutral,Negative
We support ISIS industry standard secure JP,Positive
TMobileHelp Youre ones make claim ISIS standard How let public decide,Neutral
So many spam wordpress signups com address,Negative
Wed like help Do mind clarify issue account spend spam receive spam email SC,Positive
Last night I announce news shake industry Today make sure everyone take advantage,Positive
Hope good gamers new account tweet thoughts,Positive
Dogs allow train Laura As long keep seat lead fine JG,Positive
VirginTrains dog allow train allow owner charge ticket like everyone else,Positive
National Rail Conditions Carriage state must allow dog train We dog lovers JG,Positive
Anyone else experience Sidepanel issue Outlook since version Every user sidepanel go askforce,Neutral
Hi sainsburys actual fruit easy peeler Clementine satsuma,Positive
Hi Mark Those easy peelers Clementines Hope help Cheers Tiffany,Positive
Were curious What city wishlist new Kimpton travel hotels hospitality poll,Positive
Kimpton My hometown Cincinnati So Im stick inflatable bed visit folks,Positive
sainsburys right unable round nearest‚ till poppy appeal You lose donations Pontypridd,Neutral
Hi Unfortunately service available self service checkouts Thanks tweet Kash,Positive
sainsburys many thank reply cause confusion advert place ss till,Positive
Interested Isis It available nationwide complete detail visit LM,Positive
Give cocktails kick chili Hot Chocolate Vodka,Positive
Some PSN account passwords reset today routine protection To update password,Neutral
give advance SIM card Im ready Heres hop growth NFC Tech,Neutral
We think like Isis awesome TJ,Positive
get free trial code cox wifi place enter code wifi splash page Help Only thing I enter email pw,Positive
Hello Jkeera I want help WIFI Can give detail free trial offer Tiff,Positive
CoxHelp provide special character code try cox wifi Am cox customer But I try use code place enter,Positive
How acquire information Was email ‚ If would able forward Derrick,Neutral
CoxHelp yes Dm email forward,Positive
Hi forward email email Renee,Positive
CoxHelp thank Just send,Positive
Youre welcome We check email Renee,Positive
Unreservable coach new timetable follow car Pendolino Coach E car Pendolino Coaches U F,Neutral
I key title wrongly It Ms instead Mr Case TWJK How modify,Negative
Hi may I book number correct detail,Positive
Thanks I manage get change live chat,Positive
